Жон Жэй,Жон Жэй,1745 онд төрсөн,1829 онд өнгөрсөн,АНУ-ын Урлаг ба Шинжлэх Ухааны Академийн гишүүн,Нью-Йоркийн амбан захирагч,АНУ-ын гадаад хэргийн сайд,1800 United States vice-presidential candidates,18th-century American diplomats,18th-century American judges,18th-century American politicians,19th-century American politicians,American Bible Society,American abolitionists,American people of Dutch descent,American people of French descent,American slave owners,Candidates in the 1788–1789 United States presidential election,Candidates in the 1796 United States presidential election,Chief justices of the United States,Columbia College (New York) alumni,Continental Congressmen from New York (state),Federalist Party state governors of the United States,Fellows of the American Academy of Arts and Sciences,Founding Fathers of the United States,Governors of New York (state),Huguenot participants in the American Revolution,Jay family,John Jay,Members of the American Antiquarian Society,Members of the New York Manumission Society,New York (state) Federalists,New York (state) lawyers,Patriots in the American Revolution,People from Bedford, New York,People from Katonah,People from Rye,People of the Province of New York,Signers of the Continental Association,The Federalist Papers,United States Secretaries of State,United States Secretary of Foreign Affairs,United States federal judges admitted to the practice of law by reading law,United States federal judges appointed by George Washington,Van Cortlandt family,Washington administration cabinet members,АНУ-ын Гүн Ухааны Нийгэмлэгийн гишүүн,Континентал Конгрессын гишүүн,18-р зууны улс төрч,Америкчууд,Kategorie:Außenminister (Vereinigte Staaten),Kategorie:Botschafter der Vereinigten Staaten in Spanien,Kategorie:Chief Justice of the United States,Kategorie:Geboren 1745,Kategorie:Gestorben 1829,Kategorie:Gouverneur (New York),Kategorie:John Jay,Kategorie:Mann,Kategorie:Mitglied der American Academy of Arts and Sciences,Kategorie:Mitglied der American Philosophical Society,Kategorie:Mitglied des Kontinentalkongresses,Kategorie:Politiker (18. Jahrhundert),Kategorie:US-Amerikaner
Жон Мартин Бойл,Жон Мартин Бойл,1934 онд төрсөн,Australian male sport wrestlers,Living people,Olympic wrestlers of Australia,Place of birth missing (living people),Wrestlers at the 1964 Summer Olympics
Жон Мейнард Кейнс,Жон Мейнард Кейнс,1883 онд төрсөн,1946 онд өнгөрсөн,Кембрижийн Кингс Коллежийн төгсөгч,Угаалгын одон шагналтан (компаньон),Британийн Академийн гишүүн,19th-century English LGBT people,20th-century British economists,20th-century English LGBT people,20th-century English businesspeople,20th-century English philosophers,Academics of the University of Cambridge,Alumni of King's College, Cambridge,Barons created by George VI,Bisexual academics,Bisexual male writers,Bisexual scientists,Bloomsbury Group,Bretton Woods Conference delegates,British Empire in World War II,British Zionists,British bibliophiles,British conscientious objectors,British social liberals,Cambridge University Moral Sciences Club,Chatham House people,Companions of the Order of the Bath,Economics journal editors,English LGBT politicians,English LGBT scientists,English agnostics,English art collectors,English atheists,English bisexual writers,English eugenicists,English farmers,English investors,English philanthropists,English stock traders,Fellows of King's College,Fellows of the British Academy,Fellows of the Econometric Society,Historians of economic thought,John Maynard Keynes,Keynes family,Keynesian economics,Keynesians,LGBT peers,LGBT philosophers,Liberal Party (UK) hereditary peers,Members of the Inner Temple,People educated at Eton College,People educated at St Faith's School,People from Firle,Political realists,Presidents of the Cambridge Union,Presidents of the Econometric Society,Probability theorists,Use British English from August 2011,Virtue ethicists,Их Британичууд,Англичууд,Санхүү судлал,Их Британийн Либерал Намын гишүүн,20-р зууны математикч,АНУ-ын Урлаг ба Шинжлэх Ухааны Академийн гишүүн,Язгууртны танхимын гишүүн,Санхүүгийн зах зээлийн хүн,Либерализмын хүн,20-р зууны улс төрч,Улс төр судлаач,Улс төрийн гүн ухаантан,20-р зууны эдийн засагч,Kategorie:Bloomsbury-Gruppe,Kategorie:Brite,Kategorie:Engländer,Kategorie:Finanzwissenschaft,Kategorie:Geboren 1883,Kategorie:Gestorben 1946,Kategorie:Liberal-Party-Mitglied,Kategorie:Mann,Kategorie:Mathematiker (20. Jahrhundert),Kategorie:Mitglied der American Academy of Arts and Sciences,Kategorie:Mitglied der British Academy,Kategorie:Mitglied des House of Lords,Kategorie:Person (Finanzmarkt),Kategorie:Person des Liberalismus,Kategorie:Politiker (20. Jahrhundert),Kategorie:Politikwissenschaftler,Kategorie:Politischer Philosoph,Kategorie:Vertreter des klassischen Keynesianismus,Kategorie:Ökonom (20. Jahrhundert)
Жон Форбс Нэш,Жон Форбс Нэш,1928 онд төрсөн,2015 онд өнгөрсөн,АНУ-ын Гүн Ухааны Нийгэмлэгийн гишүүн,АНУ-ын Үндэсний Шинжлэх Ухааны Академийн гишүүн,Эдийн засгийн шинжлэх ухаан дахь Альфред Нобелийн дурсгалын шагналтан,Принстон их сургуулийн багш,20th-century American mathematicians,Abel Prize laureates,American Nobel laureates,American atheists,Board game designers,Carnegie Mellon University alumni,Differential geometers,Fellows of the American Mathematical Society,Fellows of the Econometric Society,Fellows of the Institute for Operations Research and the Management Sciences,Game theorists,Institute for Advanced Study visiting scholars,John von Neumann Theory Prize winners,Massachusetts Institute of Technology School of Science faculty,Mathematicians from New Jersey,Mathematicians from West Virginia,McLean Hospital patients,Members of the American Philosophical Society,Members of the United States National Academy of Sciences,Nobel laureates in Economics,PDE theorists,People from Bluefield, West Virginia,People from West Windsor, New Jersey,People with schizophrenia,Princeton University alumni,Princeton University faculty,Road incident deaths in New Jersey,Scientists with disabilities,Афины их сургуулийн хүндэт доктор,АНУ-ын их сургуулийн хүндэт доктор,Массачусеттсын Технологийн Хүрээлэнгийн багш,20-р зууны математикч,АНУ-ын Урлаг ба Шинжлэх Ухааны Академийн гишүүн,Норвегийн Шинжлэх Ухааны Академийн гишүүн,Тоглоомын онол,Америкчууд,Kategorie:Differentialgeometer (20. Jahrhundert),Kategorie:Ehrendoktor der Nationalen und Kapodistrias-Universität Athen,Kategorie:Ehrendoktor einer Universität in den Vereinigten Staaten,Kategorie:Fellow der American Mathematical Society,Kategorie:Geboren 1928,Kategorie:Gestorben 2015,Kategorie:Hochschullehrer (Massachusetts Institute of Technology),Kategorie:Hochschullehrer (Princeton University),Kategorie:Mann,Kategorie:Mathematiker (20. Jahrhundert),Kategorie:Mitglied der American Academy of Arts and Sciences,Kategorie:Mitglied der American Philosophical Society,Kategorie:Mitglied der National Academy of Sciences,Kategorie:Mitglied der Norwegischen Akademie der Wissenschaften,Kategorie:Spieltheorie,Kategorie:Träger des Abelpreises,Kategorie:Träger des Alfred-Nobel-Gedächtnispreises für Wirtschaftswissenschaften,Kategorie:US-Amerikaner
Жорж Маршалл,Жорж Маршалл,1880 онд төрсөн,1959 онд өнгөрсөн,АНУ-ын чөлөөт өрлөгчин,АНУ-ын дэлхийн хоёрдугаар дайны хүн,Конгрессын хүндэтгэлийн алтан медаль шагналтан,Хүндэт легионы гишүүн (их загалмай),Угаалгын одон шагналтан (өргөмжит хүлэг баатрын их загалмай),Орани-Нассау одон шагналтан (их загалмай),Гэгээн Маврикий ба Лазарын одон шагналтан (рыцарь),АНУ-ын Гүн Ухааны Нийгэмлэгийн гишүүн,Энхтайвны Нобелийн шагналтан,Хятадын иргэний дайны хүн,АНУ-ын Цэргийн Гавьяаны Медаль шагналтан,Суворовын 1-р зэргийн одон шагналтан,Перугийн Нарны одон шагналтан,Мөнгөн Од шагналтан,АНУ-ын Зэвсэгт хүчний жанжин штабын дарга,АНУ-ын гадаад хэргийн сайд,20th-century American diplomats,20th-century American politicians,American Episcopalians,American Freemasons,American Nobel laureates,American five-star officers,American humanitarians,American people of World War II,Anti-Zionism in the United States,Burials at Arlington National Cemetery,Cold War diplomats,Congressional Gold Medal recipients,Episcopalians from Pennsylvania,Grand Cross of the Legion of Honour,Grand Crosses of the Order of George I with Swords,Honorary Knights Grand Cross of the Order of the Bath,Incomplete lists from August 2020,Knights Grand Cross of the Order of Orange-Nassau,Knights of the Order of Saints Maurice and Lazarus,Marshall family (political family),Members of the American Philosophical Society,Military personnel from Pennsylvania,Nobel Peace Prize laureates,People from Leesburg, Virginia,People from Uniontown, Pennsylvania,People of the Chinese Civil War,Recipients of the Croix de Guerre (France),Recipients of the Distinguished Service Medal (US Army),Recipients of the Legion of Honour,Recipients of the Order of Suvorov, 1st class,Recipients of the Order of the Sun of Peru,Recipients of the Silver Star,Time Person of the Year,Truman administration cabinet members,United States Army Chiefs of Staff,United States Army Command and General Staff College alumni,United States Army Infantry Branch personnel,United States Army War College alumni,United States Army generals,United States Army generals of World War II,United States Army personnel of World War I,United States Secretaries of Defense,United States Secretaries of State,VMI Keydets football players,Virginia Independents,Virginia Military Institute alumni,АНУ-ын армийн генерал,20-р зууны чөлөөт өрлөгчин,Карлын шагналтан,АНУ-ын дэлхийн нэгдүгээр дайны хүн,АНУ-ын Номхон далайн дайны хүн,АНУ-ын Хөдөлмөрийн Гавьяаны Загалмай шагналтан,Италийн Титэм одон шагналтан (зэрэг тодорхой бус),Алауитын Сэнтий одон шагналтан,Америкчууд,Kategorie:Armeegeneral (United States Army),Kategorie:Außenminister (Vereinigte Staaten),Kategorie:Chief of Staff of the Army (Vereinigte Staaten),Kategorie:Freimaurer (20. Jahrhundert),Kategorie:Freimaurer (Vereinigte Staaten),Kategorie:Friedensnobelpreisträger,Kategorie:Geboren 1880,Kategorie:George C. Marshall,Kategorie:Gestorben 1959,Kategorie:Honorary Knight Grand Cross des Order of the Bath,Kategorie:Karlspreisträger,Kategorie:Mann,Kategorie:Mitglied der American Philosophical Society,Kategorie:Mitglied der Ehrenlegion (Großkreuz),Kategorie:Person (Uniontown, Pennsylvania),Kategorie:Person im Chinesischen Bürgerkrieg,Kategorie:Person im Ersten Weltkrieg (Vereinigte Staaten),Kategorie:Person im Pazifikkrieg (Vereinigte Staaten),Kategorie:Person im Zweiten Weltkrieg (Vereinigte Staaten),Kategorie:Präsident (Amerikanisches Rotes Kreuz),Kategorie:Träger der Goldenen Ehrenmedaille des Kongresses,Kategorie:Träger des Distinguished Service Cross (Vereinigte Staaten),Kategorie:Träger des Ordens El Sol del Perú,Kategorie:Träger des Ordens der Krone von Italien (Ausprägung unbekannt),Kategorie:Träger des Ordens von Oranien-Nassau (Großkreuz),Kategorie:Träger des Ouissam Alaouite,Kategorie:Träger des Silver Star,Kategorie:UN-Sondergesandter,Kategorie:US-Amerikaner,Kategorie:Verteidigungsminister (Vereinigte Staaten)
Жорж Помпиду,Жорж Помпиду,1911 онд төрсөн,1974 онд өнгөрсөн,Угаалгын одон шагналтан (өргөмжит хүлэг баатрын их загалмай),Андоррын хамтын ван,20th-century Princes of Andorra,20th-century presidents of France,Deaths from cancer in France,Deaths from lymphoma,French Army officers,French Army personnel of World War II,French Roman Catholics,Gaullism,Honorary Knights Grand Cross of the Order of the Bath,Lycée Henri-IV teachers,Lycée Louis-le-Grand alumni,People from Cantal,People of the Cold War,Princes of Andorra,Sciences Po alumni,École Normale Supérieure alumni,Францчууд,Хүндэт легионы гишүүн (их загалмай),Францын Үндэсний Чуулганы гишүүн,Паневропын холбооны гишүүн,Францын дэлхийн хоёрдугаар дайны хүн,20-р зууны улс төрч,Францын ерөнхий сайд,Нассаугийн Ордны Алтан Арслан одонгийн хүлэг баатар шагналтан,Францын ерөнхийлөгч,Гэгээн Олафын одон шагналтан (их загалмай),Италийн Бүгд Найрамдах Улсын Гавьяаны одон шагналтан (их загалмай одонгийн гинжтэй),Kategorie:Franzose,Kategorie:Geboren 1911,Kategorie:Georges Pompidou,Kategorie:Gestorben 1974,Kategorie:Mann,Kategorie:Mitglied der Ehrenlegion (Großkreuz),Kategorie:Mitglied der Nationalversammlung (Frankreich),Kategorie:Mitglied der Paneuropa-Union,Kategorie:Mitglied des Conseil constitutionnel (Frankreich),Kategorie:Mitglied des Rassemblement du peuple français,Kategorie:Person (Vierte Französische Republik),Kategorie:Person im Zweiten Weltkrieg (Frankreich),Kategorie:Politiker (20. Jahrhundert),Kategorie:Premierminister (Frankreich),Kategorie:Ritter des Nassauischen Hausordens vom Goldenen Löwen,Kategorie:Romanist,Kategorie:Staatspräsident (Frankreich),Kategorie:Träger des Sankt-Olav-Ordens (Großkreuz),Kategorie:Träger des Verdienstordens der Italienischen Republik (Großkreuz mit Ordenskette)
Жулиан Ассанж,Жулиан Ассанж,1971 онд төрсөн,21st-century Australian male writers,Activists from Melbourne,Article sections to be split from February 2023,Australian computer programmers,Australian criminals,Australian editors,Australian expatriates in England,Australian founders,Australian libertarians,Australian people imprisoned abroad,Australian publishers (people),Australian whistleblowers,Biography with signature,Central Queensland University alumni,Cypherpunks,Hackers,Inmates of HM Prison Belmarsh,Julian Assange,Living people,Media critics,Open content activists,People associated with Russian interference in the 2016 United States elections,People associated with WikiLeaks,People convicted of cybercrime,People from Townsville,People who lost Ecuadorian citizenship,People with Asperger syndrome,Political party founders,Prisoners and detainees of England and Wales,RT (TV network) people,University of Melbourne alumni,Use Australian English from March 2023,Идэвхтэн,Австраличууд,Эквадорчууд,Хакер (компьютерын аюулгүй байдал),Эрэн сурвалжлах сэтгүүлч,Сүлжээний соёлын хүн,Программ хангамж хөгжүүлэгч,Kategorie:Aktivist,Kategorie:Australier,Kategorie:Ecuadorianer,Kategorie:Entwickler Freier Software,Kategorie:Folteropfer,Kategorie:Geboren 1971,Kategorie:Hacker (Computersicherheit),Kategorie:Internetaktivist,Kategorie:Investigativjournalist,Kategorie:Journalist (Australien),Kategorie:Mann,Kategorie:Person (Netzkultur),Kategorie:Person (Townsville),Kategorie:Softwareentwickler,Kategorie:WikiLeaks
Зепп Блаттер,Зепп Блаттер,1936 онд төрсөн,Холбооны Германы Их Гавьяаны Загалмай одон шагналтан,Мандах Нар одон шагналтан (их загалмай),Олон улсын олимпын хорооны гишүүн,ФИФА-гийн ерөнхийлөгч,Цэцэн Ярослав вангийн одон шагналтан (2-р зэрэг),Цэцэн Ярослав вангийн одон шагналтан (3-р зэрэг),Commanders Crosses of the Order of Merit of the Federal Republic of Germany,Corruption in Switzerland,English Football Hall of Fame inductees,Grand Cordons of the Order of the Rising Sun,International Olympic Committee members,Living people,People from Visp (district),People stripped of honorary degrees,Presidents of FIFA,Recipients of orders, decorations, and medals of Sudan,Recipients of the Olympic Order,Recipients of the Order of Honour (Moldova),Recipients of the Order of Prince Yaroslav the Wise, 2nd class, 3rd class,Recipients of the Order of the Companions of O. R. Tambo,Sepp Blatter,Swiss Roman Catholics,Swiss economists,Swiss public relations people,Swiss sports executives and administrators,University of Lausanne alumni,Хүндэт легионы гишүүн (рыцарь),Швейцарчууд,Австрийн Бүгд Найрамдах Улсын төлөөх гавьяаны их мөнгөн хүндэт тэмдгийн шагналтан,Бернардо О’Хиггинсийн одон шагналтан,Алауитын Сэнтий одон шагналтан,Алтан гадас одон шагналтан,Kategorie:Ehrenbürger im Kanton Wallis,Kategorie:Ehrenbürger von Texas,Kategorie:Ehrenmitglied des Deutschen Fußball-Bundes,Kategorie:Fußballfunktionär (Schweiz),Kategorie:Geboren 1936,Kategorie:IOC-Mitglied,Kategorie:Korporierter in der Schweizerischen Studentenverbindung Helvetia,Kategorie:Mann,Kategorie:Mitglied der Ehrenlegion (Ritter),Kategorie:Präsident (FIFA),Kategorie:Schweizer,Kategorie:Träger des Großen Bundesverdienstkreuzes,Kategorie:Träger des Großen Silbernen Ehrenzeichens für Verdienste um die Republik Österreich,Kategorie:Träger des Ordens Bernardo O’Higgins,Kategorie:Träger des Ordens der Aufgehenden Sonne (Großkreuz),Kategorie:Träger des Ordens des Fürsten Jaroslaw des Weisen (II. Klasse),Kategorie:Träger des Ouissam Alaouite,Kategorie:Träger des Polarsternordens
Зураб Жвания,Зураб Жвания,1963 онд төрсөн,2005 онд өнгөрсөн,20th-century politicians from Georgia (country),21st-century politicians from Georgia (country),Accidental deaths in Georgia (country),Burials at Didube Pantheon,Deaths from carbon monoxide poisoning,Georgian people of Armenian descent,Green Party of Georgia politicians,Jewish politicians from Georgia (country),Mingrelians,Politicians from Tbilisi,Prime Ministers of Georgia,Speakers of the Parliament of Georgia,Union of Citizens of Georgia politicians,Гүржүүд,Kategorie:Geboren 1963,Kategorie:Georgier,Kategorie:Gestorben 2005,Kategorie:Mann,Kategorie:Parlamentspräsident (Georgien),Kategorie:Premierminister (Georgien)
Иван Крылов,Иван Крылов,1769 онд төрсөн,1844 онд өнгөрсөн,Оросын Хаант Улсын сэтгүүлч,Москвагийн зохиолч,18th-century male writers,18th-century writers from the Russian Empire,19th-century writers from the Russian Empire,Burials at Tikhvin Cemetery,Dramatists and playwrights from the Russian Empire,Full members of the Saint Petersburg Academy of Sciences,Journalists from the Russian Empire,Male poets from the Russian Empire,Male writers from the Russian Empire,Members of the Russian Academy,Writers from Moscow,Зохиогч,Ёгт үлгэр,18-р зууны утга зохиол,19-р зууны утга зохиол,Орос хэлээрх утга зохиол,Оросын Шинжлэх Ухааны Академийн гишүүн,Оросууд,Kategorie:Autor,Kategorie:Fabel,Kategorie:Geboren 1769,Kategorie:Gestorben 1844,Kategorie:Journalist (Russisches Kaiserreich),Kategorie:Literatur (18. Jahrhundert),Kategorie:Literatur (19. Jahrhundert),Kategorie:Literatur (Russisch),Kategorie:Mann,Kategorie:Mitglied der Russischen Akademie der Wissenschaften,Kategorie:Russe
Икаро Валдеррама,Икаро Валдеррама,1984 онд төрсөн,Colombian songwriters,Living people,Male songwriters,Зохиогч,Колумбичууд,21-р зууны утга зохиол,Испани хэлээрх утга зохиол,Колумбийн хөгжимчин,Дуу зохиогч,Kategorie:Autor,Kategorie:Geboren 1984,Kategorie:Kolumbianer,Kategorie:Literatur (21. Jahrhundert),Kategorie:Literatur (Spanisch),Kategorie:Mann,Kategorie:Multiinstrumentalist,Kategorie:Musiker (Kolumbien),Kategorie:Songwriter
Илья Березин,Илья Березин,1818 онд төрсөн,1896 онд өнгөрсөн,Санкт-Петербургийн Улсын Их Сургуулийн багш,Academic staff of Saint Petersburg State University,Burials at Novodevichy Cemetery (Saint Petersburg),Historians from the Russian Empire,Kazan Federal University alumni,Kurdologists,Orientalists from the Russian Empire,People from Perm Krai,People from Permsky Uyezd,Philologists from the Russian Empire,Privy Councillor (Russian Empire),Recipients of the Order of Saint Stanislaus (Russian), 1st class,Recipients of the Order of St. Anna,Recipients of the Order of St. Vladimir, 3rd class,Translators from the Russian Empire,Казанийн Улсын Их Сургуулийн багш,Монголч эрдэмтэн,Дорно дахин судлаач,Оросууд,Турк судлаач,Kategorie:Geboren 1818,Kategorie:Gestorben 1896,Kategorie:Hochschullehrer (Staatliche Universität Kasan),Kategorie:Hochschullehrer (Staatliche Universität Sankt Petersburg),Kategorie:Iranist,Kategorie:Mann,Kategorie:Mongolist,Kategorie:Orientalist,Kategorie:Russe,Kategorie:Turkologe
