Саадвани Раунак,Саадвани Раунак,2005 онд төрсөн,Энэтхэгийн шатарчин,Chess grandmasters,EngvarB from January 2017,Indian chess players,Living people,People from Nagpur,Sindhi people
Савва Лукич Рагузинский-Владиславич,Савва Лукич Рагузинский-Владиславич,1669 онд төрсөн,Оросын Хаант Улсын дипломат төлөөлөгч,Итали хэлнээс орчуулагч,Орос хэл рүү орчуулагч,1738 онд өнгөрсөн,18th-century Serbian people,18th-century diplomats of the Russian Empire,18th-century translators,20th-century translators,Ambassadors of the Russian Empire to China,Burials at the Annunciation Church of the Alexander Nevsky Lavra,Diplomats of the Russian Empire,Emigrants from the Ottoman Empire to the Russian Empire,People from Gacko,People from the Republic of Ragusa,People from the Russian Empire of Serbian descent,Russian people of Serbian descent,Serbs of Bosnia and Herzegovina,Translators from Italian,Translators to Russian,Оросууд,Сербичүүд,Kategorie:Diplomat (Russisches Kaiserreich),Kategorie:Geboren 1668,Kategorie:Gestorben 1738,Kategorie:Mann,Kategorie:Russe,Kategorie:Serbe
Сергей Юльевич Витте,Сергей Юльевич Витте,1915 онд өнгөрсөн,Хүндэт легионы гишүүн (их загалмай),Португалын Христийн одон шагналтан (их загалмай),Данеброг одонгийн их загалмай,Румыны Од шагналтан (их загалмай),Оросын Хаант Улсын ерөнхий сайд,Оросын Хаант Улсын улс төрч,Хаан ба Ханы Цагаан бүргэд одон шагналтан,1849 онд төрсөн,Baltic German people from the Russian Empire,Burials at Lazarevskoe Cemetery (Saint Petersburg),Committee of Ministers of the Russian Empire,Deaths from brain cancer in Russia,Grand Cross of the Legion of Honour,Grand Crosses of the Order of Christ (Portugal),Grand Crosses of the Order of Vasa,Grand Crosses of the Order of the Dannebrog,Grand Crosses of the Order of the Star of Romania,Heads of government of the Russian Empire,Members of the State Council (Russian Empire),People from Tiflis Governorate,People of the 1905 Russian Revolution,Politicians from Tbilisi,Politicians of the Russian Empire,Recipients of the Order of St. Anna, 1st class,Recipients of the Order of St. Vladimir,Recipients of the Order of the Cross of Takovo,Recipients of the Order of the White Eagle (Russia),Russian people of the Russo-Japanese War,Southwestern Railways,Балтын Германчууд,Оросын Шинжлэх Ухааны Академийн хүндэт гишүүн,Тбилисийн хүн,Орос-Японы дайны хүн,Хар Бүргэд одонгийн хүлэг баатар,Оросууд,Оросын Германчууд,Kategorie:Deutsch-Balte,Kategorie:Ehrenmitglied der Russischen Akademie der Wissenschaften,Kategorie:Finanzminister (Russisches Kaiserreich),Kategorie:Geboren 1849,Kategorie:Gestorben 1915,Kategorie:Mann,Kategorie:Ministerpräsident (Russisches Kaiserreich),Kategorie:Person (Tiflis),Kategorie:Person im Russisch-Japanischen Krieg,Kategorie:Politiker (Russisches Kaiserreich),Kategorie:Ritter des Schwarzen Adlerordens,Kategorie:Russe,Kategorie:Russlanddeutscher
Сидней Марш,Сидней Марш,1939 онд төрсөн,20th-century Australian people,21st-century Australian people,Australian male sport wrestlers,Commonwealth Games medallists in wrestling,Commonwealth Games silver medallists for Australia,Living people,Medallists at the 1962 British Empire and Commonwealth Games,Olympic wrestlers of Australia,Sportsmen from New South Wales,Wrestlers at the 1962 British Empire and Commonwealth Games,Wrestlers at the 1964 Summer Olympics,1968 оны зуны олимпод оролцогч
Станислав Шушкевич,Станислав Шушкевич,1934 онд төрсөн,2022 онд өнгөрсөн,Беларусийн ерөнхийлөгч,Belarusian Roman Catholics,Belarusian Social Democratic Assembly politicians,Belarusian State University alumni,Belarusian people of Polish descent,Candidates for President of Belarus,Deaths from the COVID-19 pandemic in Belarus,Members of the Supreme Council of Belarus,Politicians from Minsk,Presidents of Belarus,Scientists from Minsk,Soviet engineers,Беларусьчууд,20-р зууны улс төрч,Беларусийн улс төрч,Зөвлөлтийн иргэн,Төрийн тэргүүн,Социал демократ намын дарга,Kategorie:Belarusse,Kategorie:Geboren 1934,Kategorie:Gestorben 2022,Kategorie:Mann,Kategorie:Parlamentspräsident,Kategorie:Parteivorsitzender (Belarus),Kategorie:Politiker (20. Jahrhundert),Kategorie:Politiker (Belarus),Kategorie:Sowjetbürger,Kategorie:Staatsoberhaupt,Kategorie:Vorsitzender einer sozialdemokratischen Partei
Степан Бандера,Степан Бандера,1909 онд төрсөн,1959 онд өнгөрсөн,Ивано-Франковск мужийн хүн,All pages needing factual verification,Anti-Polish sentiment,Anti-Romanian sentiment,Anti-Russian sentiment,Antisemitism in Ukraine,Assassinated Ukrainian politicians,Burials at Lychakiv Cemetery,Burials at Munich Waldfriedhof,Deaths by cyanide poisoning,Deaths by poisonous gas,Extrajudicial killings,Holocaust perpetrators in Poland,Inmates of Bereza Kartuska Prison,Lviv Polytechnic alumni,Massacres of Poles in Eastern Galicia,Massacres of Poles in Volhynia,Members of the Ukrainian Greek Catholic Church,Organization of Ukrainian Nationalists politicians,People from Ivano-Frankivsk Oblast,People from the Kingdom of Galicia and Lodomeria,People killed in KGB operations,People murdered in Germany,Prisoners sentenced to death by Poland,Recipients who were revoked of the title of Hero of Ukraine,Sachsenhausen concentration camp survivors,Scouting and Guiding in Ukraine,Terrorism in Poland,Ukrainian Austro-Hungarians,Ukrainian Insurgent Army,Ukrainian anti-communists,Ukrainian collaborators with Nazi Germany,Ukrainian independence activists,Ukrainian people murdered abroad,Ukrainian politicians before 1991,Ukrainian prisoners sentenced to death,Ukrainian refugees,Ukrainian revolutionaries,Vague or ambiguous time from October 2022,Львовын хүндэт иргэн,Украин улсын баатар,Хэт барууны үзэлт байгууллагын гишүүн,Хүн амины хэргийн хохирогч,Аллагын хохирогч,Фашизмын хүн,20-р зууны улс төрч,Украины улс төрч,Холокостын гэмт хэрэгтэн,Украинчууд,Украины зэвсэгт хүчний түүх,Украины цагаач,Цаазлуулах ялтай хүн,Kategorie:Ehrenbürger von Lwiw,Kategorie:Geboren 1909,Kategorie:Gestorben 1959,Kategorie:Held der Ukraine,Kategorie:Häftling im KZ Sachsenhausen,Kategorie:Mann,Kategorie:Mitglied der Organisation Ukrainischer Nationalisten,Kategorie:Mitglied einer antisemitischen Organisation,Kategorie:Mitglied einer rassistischen Organisation,Kategorie:Mitglied einer rechtsextremen Organisation,Kategorie:Mordopfer,Kategorie:Opfer eines Attentats,Kategorie:Person (Partisanenkrieg im Zweiten Weltkrieg),Kategorie:Person (Wolhynien),Kategorie:Person (ukrainische Kollaboration),Kategorie:Person des Faschismus,Kategorie:Politiker (20. Jahrhundert),Kategorie:Politiker (Ukraine),Kategorie:Täter des Holocaust,Kategorie:Ukrainer,Kategorie:Ukrainische Militärgeschichte,Kategorie:Ukrainischer Emigrant,Kategorie:Zum Tode verurteilte Person
Стефан Цвейг,Стефан Цвейг,1881 онд төрсөн,1942 онд өнгөрсөн,Венийн зохиолч,1942 suicides,20th-century Austrian dramatists and playwrights,20th-century Austrian journalists,20th-century Austrian novelists,20th-century biographers,Anti-nationalism,Austrian biographers,Austrian emigrants to Brazil,Austrian emigrants to England,Austrian exiles,Austrian male dramatists and playwrights,Austrian male novelists,Austrian refugees,Austro-Hungarian Jews,Barbiturates-related онд өнгөрсөн,Biography with signature,Drug-related suicides in Brazil,EngvarB from November 2017,Exilliteratur writers,Jewish dramatists and playwrights,Jewish novelists,Jews who immigrated to the United Kingdom to escape Nazism,Joint suicides,Male biographers,People from Innere Stadt,Stefan Zweig,Suicides by Jews during the Holocaust,Writers from Austria-Hungary,Writers from Vienna,Өөрийн намтар,Зохиогч,Намтар,Утга зохиолын захидал,Их Британичууд,Драм,Либреттист,20-р зууны утга зохиол,Герман хэлээрх утга зохиол,Уянгын шүлэгч,Нацизмын хэлмэгдэгч,Тууж,Цислейтанийн хүн,Роман,Өдрийн тэмдэглэл,Өмнөдийн Загалмай Үндэсний одон шагналтан,Австричууд,Нацизмын үед Австриас дүрвэгч,Франц хэлнээс орчуулагч,Итали хэлнээс орчуулагч,Герман хэл рүү орчуулагч,Kategorie:Autobiografie,Kategorie:Autographensammler,Kategorie:Autor,Kategorie:Biografie,Kategorie:Brief (Literatur),Kategorie:Brite,Kategorie:Drama,Kategorie:Emigrant in Brasilien,Kategorie:Geboren 1881,Kategorie:Gestorben 1942,Kategorie:Kochgasse 8,Kategorie:Librettist,Kategorie:Literatur (20. Jahrhundert),Kategorie:Literatur (Deutsch),Kategorie:Literatur (Österreich),Kategorie:Lyrik,Kategorie:Mann,Kategorie:NS-Opfer,Kategorie:Novelle,Kategorie:Person, für die in Österreich ein Stolperstein verlegt wurde,Kategorie:Person (Cisleithanien),Kategorie:Person (Die Presse),Kategorie:Person (Geschichte Brasiliens),Kategorie:Roman, Epik,Kategorie:Schriftsteller (Salzburg),Kategorie:Schriftsteller (Wien),Kategorie:Stefan Zweig,Kategorie:Tagebuch,Kategorie:Träger des Nationalen Ordens vom Kreuz des Südens,Kategorie:Österreicher,Kategorie:Österreichischer Emigrant im Vereinigten Königreich,Kategorie:Österreichischer Emigrant zur Zeit des Nationalsozialismus,Kategorie:Übersetzer aus dem Französischen,Kategorie:Übersetzer aus dem Italienischen,Kategorie:Übersetzer ins Deutsche
Стифен Вебстер,Стифен Вебстер,1959 онд төрсөн,British jewellery designers,English jewellers,Living people,Members of the Order of the British Empire,People educated at Gravesend Grammar School,People from Gravesend, Kent
Сушил Кумар,Сушил Кумар,1983 онд төрсөн,Бөхийн азийн наадмын аварга,Аржуна шагналтан,Ражив Ганди Кхел Ратна шагналтан,Asian Games bronze medalists for India,Asian Games medalists in wrestling,Asian Wrestling Championships medalists,Commonwealth Games gold medallists for India,Commonwealth Games medallists in wrestling,Indian Hindus,Indian male sport wrestlers,Living people,Medalists at the 2006 Asian Games,Medalists at the 2008 Summer Olympics,Medalists at the 2012 Summer Olympics,Medallists at the 2010 Commonwealth Games,Medallists at the 2014 Commonwealth Games,Medallists at the 2018 Commonwealth Games,Olympic bronze medalists for India,Olympic medalists in wrestling,Olympic silver medalists for India,Olympic wrestlers of India,Olympics.com template with same ID for Olympic.org,People from South West Delhi district,Recipients of the Arjuna Award,Recipients of the Khel Ratna Award,Recipients of the Padma Shri in sports,Sport wrestlers from Delhi,Sport wrestlers from Haryana,Use British English from September 2013,World Wrestling Championships medalists,Wrestlers at the 2004 Summer Olympics,Wrestlers at the 2006 Asian Games,Wrestlers at the 2008 Summer Olympics,Wrestlers at the 2010 Commonwealth Games,Wrestlers at the 2012 Summer Olympics,Wrestlers at the 2014 Commonwealth Games,Wrestlers at the 2018 Asian Games,Бөхийн азийн аварга,Энэтхэгчүүд,2008 оны зуны олимпод оролцогч,2012 оны зуны олимпод оролцогч,Падма Шри шагналтан,Бөхийн дэлхийн аварга,Kategorie:Asienmeister (Ringen),Kategorie:Geboren 1983,Kategorie:Inder,Kategorie:Mann,Kategorie:Olympiateilnehmer (Indien),Kategorie:Ringer (Indien),Kategorie:Sieger bei den Commonwealth Games (Ringen),Kategorie:Teilnehmer an den Asienspielen (Indien),Kategorie:Teilnehmer an den Commonwealth Games (Indien),Kategorie:Teilnehmer der Olympischen Sommerspiele 2008,Kategorie:Teilnehmer der Olympischen Sommerspiele 2012,Kategorie:Träger des Arjuna Award,Kategorie:Träger des Padma Shri,Kategorie:Träger des Rajiv Gandhi Khel Ratna,Kategorie:Weltmeister (Ringen)
Сэмуэл Филлипс Хантингтон,Сэмуэл Филлипс Хантингтон,1927 онд төрсөн,2008 онд өнгөрсөн,Коламбиа их сургуулийн багш,АНУ-ын Урлаг ба Шинжлэх Ухааны Академийн гишүүн,Геополитикч,Харвардын их сургуулийн төгсөгч,Харвардын их сургуулийн багш,АНУ-ын армийн зэвсэгт хүчний хүн,Иелийн их сургуулийн төгсөгч,20th-century American male writers,20th-century American non-fiction writers,20th-century political scientists,21st-century American male writers,21st-century American non-fiction writers,American international relations scholars,American male non-fiction writers,American people of Dutch descent,American people of English descent,American political scientists,American political writers,Columbia University faculty,Fellows of the American Academy of Arts and Sciences,Geopoliticians,Harvard University alumni,Harvard University faculty,John M. Olin Foundation,People appearing on C-SPAN,Phillips family (New England),Political realists,Revolution theorists,Schuyler family,Stuyvesant High School alumni,Theorists on Western civilization,United States Army personnel,United States National Security Council staffers,University of Chicago alumni,Use American English from March 2020,Woolsey family,Writers about globalization,Yale University alumni,Зохиогч,Эссе,Англи хэлээрх утга зохиол,АНУ-ын утга зохиол,Нью-Йорк хотын хүн,Улс төр судлаач,Улс төрийн утга зохиол,Америкчууд,Kategorie:Autor,Kategorie:Essay,Kategorie:Geboren 1927,Kategorie:Gestorben 2008,Kategorie:Hochschullehrer (Harvard University),Kategorie:Literatur (Englisch),Kategorie:Literatur (Vereinigte Staaten),Kategorie:Mann,Kategorie:Mitglied der American Academy of Arts and Sciences,Kategorie:Person (New York City),Kategorie:Politikwissenschaftler,Kategorie:Politische Literatur,Kategorie:Präsident der American Political Science Association,Kategorie:Theoretiker der Geopolitik,Kategorie:US-Amerikaner
Тадеуш Мазовецки,Тадеуш Мазовецки,1927 онд төрсөн,2013 онд өнгөрсөн,Эрх Чөлөөний Холбооны гишүүн,Холбооны Германы Гавьяаны Загалмай одон шагналтан (од ба мөрөвч туузтай),Польшийн ерөнхий сайд,Унгар Улсын Гавьяаны одон шагналтан,Литвын их ван Гедиминасын одон шагналтан,Цагаан Бүргэд одон шагналтан,Варшав Их Сургуулийн төгсөгч,Candidates in the 1990 Polish presidential election,Democratic Party – demokraci.pl politicians,Democratic Union (Poland) politicians,Freedom Union (Poland) politicians,Grand Crosses with Star and Sash of the Order of Merit of the Federal Republic of Germany,Knights of St. Gregory the Great,Members of the Polish Sejm 1961–1965,Members of the Polish Sejm 1965–1969,Members of the Polish Sejm 1969–1972,Members of the Polish Sejm 1991–1993,Members of the Polish Sejm 1993–1997,Members of the Polish Sejm 1997–2001,PAX Association members,People from Warsaw Voivodeship (1919–1939),Polish Roman Catholics,Polish Round Table Talks participants,Politicians from Płock,Prime Ministers of Poland,Prime Ministers of the Polish People's Republic,Recipients of the Gold Medal for Merit to Culture – Gloria Artis,Recipients of the Legion of Honour,Recipients of the Order of Merit of the Republic of Hungary,Recipients of the Order of the Lithuanian Grand Duke Gediminas,Recipients of the Order of the White Eagle (Poland),University of Warsaw alumni,Znak (association) members,Иргэний эрхийн төлөө тэмцэгч,Гданьскийн хүндэт иргэн,Познанийн хүндэт иргэн,Сараевогийн хүндэт иргэн,Варшавын хүндэт иргэн,Варшав Их Сургуулийн хүндэт доктор,Хүндэт легионы гишүүн (их офицер),Польшийн намын дарга,Польшууд,Сеймийн гишүүн (Гуравдугаар Бүгд Найрамдах Улс),Италийн Бүгд Найрамдах Улсын Гавьяаны одон шагналтан (их загалмай),Унгар Улсын Гавьяаны одон шагналтан (одтой командлагч),Kategorie:Bürgerrechtler,Kategorie:Ehrenbürger von Danzig,Kategorie:Ehrenbürger von Posen,Kategorie:Ehrenbürger von Płock,Kategorie:Ehrenbürger von Sarajevo,Kategorie:Ehrenbürger von Warschau,Kategorie:Ehrendoktor der Universität Warschau,Kategorie:Geboren 1927,Kategorie:Gestorben 2013,Kategorie:Mann,Kategorie:Ministerpräsident (Polen),Kategorie:Mitglied der Ehrenlegion (Großoffizier),Kategorie:Opfer der Diktatur der Volksrepublik Polen,Kategorie:Parteivorsitzender (Polen),Kategorie:Pole,Kategorie:Sejm-Abgeordneter (Dritte Republik),Kategorie:Sejm-Abgeordneter (Volksrepublik Polen),Kategorie:Träger des Gregoriusordens (Ausprägung unbekannt),Kategorie:Träger des Großen Bundesverdienstkreuzes mit Stern und Schulterband,Kategorie:Träger des Lothar-Kreyssig-Friedenspreises,Kategorie:Träger des Verdienstordens der Italienischen Republik (Großkreuz),Kategorie:Träger des Verdienstordens der Republik Ungarn (Komtur mit Stern),Kategorie:Träger des Weißen Adlerordens,Kategorie:UD-Mitglied,Kategorie:UW-Mitglied
Тамара Синявская,Тамара Синявская,1943 онд төрсөн,Ардын Жүжигчин (Азербайжан),Ардын Жүжигчин (ЗХУ),Living people,Operatic mezzo-sopranos,People's Artists of Azerbaijan,People's Artists of the USSR,Russian mezzo-sopranos,Russian music educators,Singers from Moscow,Soviet women opera singers,Women music educators
Теодор Рузвельт,Теодор Рузвельт,1858 онд төрсөн,1919 онд өнгөрсөн,АНУ-ын чөлөөт өрлөгчин,Афорист,Нью-Йоркийн амбан захирагч,Америкийн Урлаг ба Утга Зохиолын Академийн гишүүн,АНУ-ын Гүн Ухааны Нийгэмлэгийн гишүүн,Энхтайвны Нобелийн шагналтан,АНУ-ын ерөнхийлөгч,Рузвельт (овог),АНУ-ын дэд ерөнхийлөгч,1900 United States vice-presidential candidates,1900s in the United States,19th-century American historians,19th-century American male writers,19th-century American politicians,20th-century American male writers,20th-century American non-fiction writers,20th-century presidents of the United States,20th-century vice presidents of the United States,American Freemasons,American Nobel laureates,American autobiographers,American bibliophiles,American conservationists,American diarists,American essayists,American explorers,American fishers,American hunters,American male judoka,American male non-fiction writers,American military personnel of the Spanish–American War,American nationalists,American naval historians,American people of Dutch descent,American political party founders,American political writers,American shooting survivors,Aphorists,Bulloch family,Burials in New York (state),Candidates in the 1904 United States presidential election,Candidates in the 1912 United States presidential election,Candidates in the 1916 United States presidential election,Deaths from pulmonary embolism,English-language spelling reform advocates,Explorers of Amazonia,Governors of New York (state),Hall of Fame for Great Americans inductees,Harvard Advocate alumni,Harvard College alumni,Liberalism in the United States,Members of the American Academy of Arts and Letters,Members of the American Philosophical Society,Military personnel from New York City,New York (state) Progressives (1912),New York City Police Commissioners,Nobel Peace Prize laureates,People associated with the American Museum of Natural History,People from Oyster Bay (town), New York,Politicians from New York City,Presidential libraries,Presidents of the American Historical Association,Presidents of the United States,Progressive Era in the United States,Progressivism in the United States,Ranchers from North Dakota,Republican Party (United States) presidential nominees,Republican Party (United States) vice presidential nominees,Republican Party governors of New York (state),Republican Party members of the New York State Assembly,Republican Party presidents of the United States,Republican Party vice presidents of the United States,Roosevelt family,Rough Riders,Schuyler family,Sons of the American Revolution,Source attribution,Spanish–American War recipients of the Medal of Honor,Theodore Roosevelt,United States Army Medal of Honor recipients,United States Army officers,United States Assistant Secretaries of the Navy,Use American English from February 2019,Vice presidents of the United States,Writers from New York (state),Харвардын их сургуулийн төгсөгч,Берлиний Хумболдтын их сургуулийн хүндэт доктор,20-р зууны чөлөөт өрлөгчин,Бүгд Найрамдах Намын гишүүн (АНУ),Испани-Америкийн дайны хүн,19-р зууны улс төрч,20-р зууны улс төрч,Америкчууд,Kategorie:Absolvent der Harvard University,Kategorie:Ehrendoktor der Humboldt-Universität zu Berlin,Kategorie:Ehrendoktor der Universität Leipzig,Kategorie:Freimaurer (20. Jahrhundert),Kategorie:Freimaurer (Vereinigte Staaten),Kategorie:Friedensnobelpreisträger,Kategorie:Geboren 1858,Kategorie:Gestorben 1919,Kategorie:Gouverneur (New York),Kategorie:Korporierter (Delta Kappa Epsilon),Kategorie:Mann,Kategorie:Mitglied der American Academy of Arts and Letters,Kategorie:Mitglied der Familie Roosevelt,Kategorie:Mitglied der New York State Assembly,Kategorie:Mitglied der Progressive Party (1912),Kategorie:Mitglied der Republikanischen Partei,Kategorie:Namensgeber für ein Schiff,Kategorie:Person als Namensgeber für einen Asteroiden,Kategorie:Person im Spanisch-Amerikanischen Krieg,Kategorie:Politiker (19. Jahrhundert),Kategorie:Politiker (20. Jahrhundert),Kategorie:Präsident der Vereinigten Staaten,Kategorie:Smithsonian-Roosevelt African Expedition,Kategorie:Theodore Roosevelt,Kategorie:US-Amerikaner,Kategorie:Vizepräsident der Vereinigten Staaten
Теодул Тулотт,Теодул Тулотт,1950 онд төрсөн,French male sport wrestlers,Living people,Olympic wrestlers of France,Wrestlers at the 1972 Summer Olympics,Wrestlers at the 1976 Summer Olympics
Томас Пекхэм,Томас Пекхэм,1943 онд төрсөн,American male sport wrestlers,Living people,Olympic wrestlers of the United States,People from Cresco, Iowa,Sportspeople from Iowa,1968 оны зуны олимпод оролцогч
Уилер Тэкстон,Уилер Тэкстон,1944 онд төрсөн,Харвардын их сургуулийн төгсөгч,Харвардын их сургуулийн багш,American orientalists,Harvard University alumni,Harvard University faculty,Living people,Princeton University alumni
