Алексис Нихон Жуниор,Алексис Нихон Жуниор,1946 онд төрсөн,2013 онд өнгөрсөн,Монреалийн тамирчин,Бахамын олимпын оролцогч,Бахамын тамирчин,1968 оны зуны олимпод оролцогч
Аль Капоне,Аль Капоне,1899 онд төрсөн,1947 онд өнгөрсөн,Al Capone,American bootleggers,American businesspeople convicted of crimes,American crime bosses,American gangsters of Italian descent,American people convicted of tax crimes,Biography with signature,Catholics from Illinois,Catholics from New York (state),Chicago Outfit bosses,Chicago Outfit mobsters,Criminals from Chicago,Deaths from bleeding,Deaths from bronchopneumonia,Deaths from cerebrovascular disease,Deaths from pneumonia in Florida,Deaths from syphilis,Depression-era gangsters,Five Points Gang,Inmates of Alcatraz Federal Penitentiary,People from Cicero, Illinois,People from Park Slope,Prohibition-era gangsters,АНУ-ын түүх (1918–1945 он),Чикагогийн хүн,Хүн амины хэрэгтэн,Америкчууд,Яллагдсан хүн,Kategorie:Al Capone,Kategorie:Bandenführer,Kategorie:Geboren 1899,Kategorie:Geschichte der Vereinigten Staaten (1918–1945),Kategorie:Gestorben 1947,Kategorie:Mafioso (Vereinigte Staaten),Kategorie:Mann,Kategorie:Person (Chicago),Kategorie:Person (Mordfall),Kategorie:US-Amerikaner,Kategorie:Verurteilte Person
Америго Веспуччи,Америго Веспуччи,1512 онд өнгөрсөн,16-р зууны аялагч,Өмнөд Америк судлаач,Италийн аялагч,Боолчлогч,1451 онд төрсөн,15th-century Italian businesspeople,15th-century people of the Republic of Florence,16th-century Italian businesspeople,16th-century Italian cartographers,16th-century explorers,Biography with signature,Businesspeople from Florence,Cartographers of North America,Explorers of South America,Infectious disease deaths in Spain,Italian Roman Catholics,Italian explorers,Italian explorers of South America,Italian navigators,Maritime history of Portugal,Slave owners,15-р зууны аялагч,Америкийн нээлт,Шинэ латин хэлээрх утга зохиол,Далайчин,Kategorie:Entdecker (15. Jahrhundert),Kategorie:Entdeckung Amerikas,Kategorie:Geboren 1451,Kategorie:Gestorben 1512,Kategorie:Literatur (Neulatein),Kategorie:Mann,Kategorie:Namensgeber für ein Schiff,Kategorie:Person (Republik Florenz),Kategorie:Seefahrer,Kategorie:Südamerikaforscher
Андрей Колмогоров,Андрей Колмогоров,1903 онд төрсөн,1987 онд өнгөрсөн,Москвагийн Улсын Их Сургуулийн багш,АНУ-ын Урлаг ба Шинжлэх Ухааны Академийн гишүүн,Урсгалын механикч,Ханы Нийгэмлэгийн гадаадын гишүүн,Зөвлөлтийн социалист хөдөлмөрийн баатар,Лениний нэрэмжит шагналтан,АНУ-ын Гүн Ухааны Нийгэмлэгийн гишүүн,Францын Шинжлэх Ухааны Академийн гишүүн,Леопольдинагийн гишүүн,Зүүн Германы Шинжлэх Ухааны Академийн гишүүн,Нидерландын Ханы Шинжлэх Ухааны Академийн гишүүн,Москвагийн Улсын Их Сургуулийн төгсөгч,Лениний одон шагналтан,Хөдөлмөрийн Гавьяаны Улаан Тугийн одон шагналтан (ЗХУ),Оросын математикч,Сталиний нэрэмжит шагналтан,20th-century Russian educators,20th-century Russian mathematicians,Academic staff of Moscow State University,Academicians of the USSR Academy of Pedagogical Sciences,Approximation theorists,Burials at Novodevichy Cemetery,Control theorists,Corresponding members of the Romanian Academy,Dynamical systems theorists,Fellows of the American Academy of Arts and Sciences,Fluid dynamicists,Foreign Members of the Royal Society,Foreign associates of the National Academy of Sciences,Full Members of the USSR Academy of Sciences,Heroes of Socialist Labour,Historians of mathematics,Lenin Prize winners,Measure theorists,Members of the American Philosophical Society,Members of the French Academy of Sciences,Members of the German Academy of Sciences Leopoldina,Members of the German Academy of Sciences at Berlin,Members of the Royal Netherlands Academy of Arts and Sciences,Moscow State University alumni,People from Tambov,People from Tambovsky Uyezd,Probability theorists,Recipients of the Order of Lenin,Recipients of the Order of the Red Banner of Labour,Russian educators,Russian information theorists,Russian logicians,Russian mathematicians,Russian statisticians,Soviet educators,Soviet logicians,Soviet mathematicians,Stalin Prize winners,Systems scientists,Textbook writers,Topologists,Wolf Prize in Mathematics laureates,Балцаны шагналтан,Логик судлаач,20-р зууны математикч,20-р зууны математикийн логик судлаач,20-р зууны Леопольдинагийн гишүүн,АНУ-ын Үндэсний Шинжлэх Ухааны Академийн гишүүн,Оросын Шинжлэх Ухааны Академийн гишүүн,Зөвлөлтийн иргэн,Төрийн шагналтан (ЗХУ),Kategorie:Balzan-Preisträger,Kategorie:Ehrenmitglied der London Mathematical Society,Kategorie:Geboren 1903,Kategorie:Gestorben 1987,Kategorie:Held der sozialistischen Arbeit,Kategorie:Hochschullehrer (Lomonossow-Universität),Kategorie:Logiker,Kategorie:Mann,Kategorie:Mathematiker (20. Jahrhundert),Kategorie:Mathematischer Logiker (20. Jahrhundert),Kategorie:Mitglied der Académie des sciences,Kategorie:Mitglied der Akademie der Wissenschaften der DDR,Kategorie:Mitglied der American Academy of Arts and Sciences,Kategorie:Mitglied der American Philosophical Society,Kategorie:Mitglied der Königlich Niederländischen Akademie der Wissenschaften,Kategorie:Mitglied der Leopoldina (20. Jahrhundert),Kategorie:Mitglied der National Academy of Sciences,Kategorie:Mitglied der Royal Statistical Society,Kategorie:Mitglied der Russischen Akademie der Wissenschaften,Kategorie:Person als Namensgeber für einen Asteroiden,Kategorie:Sowjetbürger,Kategorie:Statistiker (20. Jahrhundert),Kategorie:Stochastiker (20. Jahrhundert),Kategorie:Topologe (20. Jahrhundert),Kategorie:Träger des Leninordens,Kategorie:Träger des Leninpreises,Kategorie:Träger des Ordens des Roten Banners der Arbeit,Kategorie:Träger des Staatspreises der UdSSR,Kategorie:Träger des Stalinpreises
Антонио Страдивари,Антонио Страдивари,1644 онд төрсөн,1737 онд өнгөрсөн,17th-century Italian businesspeople,18th-century Italian businesspeople,All accuracy disputes,Bowed string instrument makers,Luthiers from Cremona,Stradivari instruments,17-р зуунд төрсөн,Kategorie:Geboren im 17. Jahrhundert,Kategorie:Geigenbauer,Kategorie:Gestorben 1737,Kategorie:Gitarrenbauer,Kategorie:Historische Person (Italien),Kategorie:Mann
Аркадий Райкин,Аркадий Райкин,1911 онд төрсөн,1987 онд өнгөрсөн,Зөвлөлтийн социалист хөдөлмөрийн баатар,Ардын Жүжигчин (ЗХУ),Actors from Riga,Burials at Novodevichy Cemetery,Heroes of Socialist Labour,Jewish Russian comedians,Latvian Jews,People's Artists of the USSR,People from the Governorate of Livonia,Russian parodists,Soviet male actors,Theatre people from Riga,Кино найруулагч,Ригагийн хүн,Зөвлөлтийн иргэн,Театрын найруулагч,Лениний одон шагналтан,Лениний нэрэмжит шагналтан,Хөдөлмөрийн Гавьяаны Улаан Тугийн одон шагналтан (ЗХУ),Ардын Жүжигчин (ЗСБНХОУ),Kategorie:Filmregisseur,Kategorie:Geboren 1911,Kategorie:Gestorben 1987,Kategorie:Held der sozialistischen Arbeit,Kategorie:Mann,Kategorie:Pantomime (Darsteller),Kategorie:Person (Riga),Kategorie:Sowjetbürger,Kategorie:Theaterregisseur,Kategorie:Träger des Leninordens,Kategorie:Träger des Leninpreises,Kategorie:Träger des Ordens des Roten Banners der Arbeit,Kategorie:Verdienter Künstler der RSFSR,Kategorie:Volkskünstler der RSFSR,Kategorie:Volkskünstler der UdSSR (Darstellende Kunst)
Асанга,Асанга,Өнгөрсөн (4-р зуун),4th-century Buddhist monks,4th-century Indian philosophers,4th-century онд өнгөрсөн,Gandhara,Indian Buddhist monks,Indian scholars of Buddhism,Yogacara scholars,Зохиогч,Буддын шашны утга зохиол,Буддын шашны лам,4-р зуунд төрсөн,Махаяна буддын шашны хүн,4-р зууны шашин,Kategorie:Autor,Kategorie:Buddhismus in Indien,Kategorie:Buddhistische Literatur,Kategorie:Buddhistischer Mönch,Kategorie:Geboren im 4. Jahrhundert,Kategorie:Gestorben im 4. oder 5. Jahrhundert,Kategorie:Literatur (4. Jahrhundert),Kategorie:Mann,Kategorie:Person des Mahayana-Buddhismus,Kategorie:Religion (4. Jahrhundert)
Ашока хаан,Ашока хаан,Өнгөрсөн (МЭӨ 3-р зуун),Эртний Энэтхэг,Энэтхэгийн ноёрхогч,3rd-century BC Indian monarchs,3rd-century BC онд өнгөрсөн,3rd-century Buddhism,Ancient India,Ancient history of Afghanistan,Ancient history of Pakistan,Ashoka,Buddhist pacifists,Converts to Buddhism,History of Buddhism in India,Indian Buddhist missionaries,Indian Buddhist monarchs,Indian Buddhists,Indian monarchs,Indian pacifists,Indian warriors,Mauryan emperors,People from Patna,Use Indian English from December 2019,,Kategorie:Geboren 304 v. Chr.,Kategorie:Gestorben 232 v. Chr.,Kategorie:Indischer Frühbuddhist,Kategorie:König (Indisches Altertum),Kategorie:Mann,Kategorie:Person (Patna),Kategorie:Provinz Nakhon Pathom
Бабрак Кармаль,Бабрак Кармаль,1929 онд төрсөн,1996 онд өнгөрсөн,1970s in Afghanistan,1980s in Afghanistan,20th-century heads of state of Afghanistan,Afghan atheists,Afghan emigrants to Russia,Afghan emigrants to the Soviet Union,Afghan prisoners and detainees,Afghan revolutionaries,Collaborators with the Soviet Union,Deaths from cancer in Russia,Deaths from liver cancer,Democratic Republic of Afghanistan,People's Democratic Party of Afghanistan politicians,People granted political asylum in the Soviet Union,Presidents of Afghanistan,Prime Ministers of Afghanistan,Prisoners and detainees of Afghanistan,Афганчууд,Kategorie:Afghane,Kategorie:Afghanischer Botschafter in der Tschechoslowakei,Kategorie:Geboren 1929,Kategorie:Gestorben 1996,Kategorie:Mann,Kategorie:Premierminister (Afghanistan),Kategorie:Präsident (Afghanistan)
Бернар Арно,Бернар Арно,1949 онд төрсөн,Хүндэт легионы гишүүн (их офицер),Их Британийн эзэнт гүрэн одонгийн өргөмжит хүлэг баатрын командлагч шагналтан,20th-century French businesspeople,20th-century French philanthropists,21st-century French businesspeople,21st-century French philanthropists,Arnault family,Centibillionaires,Dior people,Directors of LVMH,French art collectors,French billionaires,French businesspeople in fashion,French chairpersons of corporations,French chief executives,French cosmetics businesspeople,French investors,Grand Officers of the Legion of Honour,Honorary Knights Commander of the Order of the British Empire,Living people,People from Roubaix,People named in the Paradise Papers,École Polytechnique alumni,Францчууд,Хөрөнгө оруулагч,Францын Урлаг ба Утга Зохиолын одон шагналтан (командлагч),Италийн Бүгд Найрамдах Улсын Гавьяаны одон шагналтан (их офицер),20-р зууны бизнесмен,21-р зууны бизнесмен,Францын бизнесмен,Kategorie:Franzose,Kategorie:Geboren 1949,Kategorie:Honorary Knight Commander des Order of the British Empire,Kategorie:Investor,Kategorie:LVMH,Kategorie:Mann,Kategorie:Mitglied der Ehrenlegion (Großoffizier),Kategorie:Träger des Ordre des Arts et des Lettres (Komtur),Kategorie:Träger des Verdienstordens der Italienischen Republik (Großoffizier),Kategorie:Unternehmer (20. Jahrhundert),Kategorie:Unternehmer (21. Jahrhundert),Kategorie:Unternehmer (Frankreich)
Валдас Адамкус,Валдас Адамкус,1926 онд төрсөн,Украины Гавьяаны одон шагналтан,Хүндэт легионы гишүүн (их загалмай),Холбооны Германы Гавьяаны Загалмай одон шагналтан (их загалмайн тусгай зэрэглэл),Их Витаутасын одон шагналтан (их загалмай одонгийн гинжтэй),Угаалгын одон шагналтан (өргөмжит хүлэг баатрын их загалмай),Шонхрын одон шагналтан (их загалмай),Италийн Бүгд Найрамдах Улсын Гавьяаны одон шагналтан (их загалмай одонгийн гинжтэй),Литвын ерөнхийлөгч,Марийн орны гинжит загалмай одон шагналтан,Австрийн Бүгд Найрамдах Улсын төлөөх гавьяаны Их-Од хүндэт тэмдгийн шагналтан,Цэцэн Ярослав вангийн одон шагналтан (1-р зэрэг),Цэцэн Ярослав вангийн одон шагналтан (2-р зэрэг),Цагаан Бүргэд одон шагналтан,ЮНЕСКО-гийн тусгай элч,American people of Lithuanian descent,Catholics from Illinois,Catholics from Ohio,Chevaliers of the Order of Merit (Ukraine),Collars of the Order of Isabella the Catholic,First Class of the Order of the Star of Romania,Grand Cross of the Legion of Honour,Grand Crosses Special Class of the Order of Merit of the Federal Republic of Germany,Grand Crosses with Golden Chain of the Order of Vytautas the Great,Honorary Knights Grand Cross of the Order of the Bath,Illinois Institute of Technology alumni,Knights Grand Cross of the Order of the Falcon,Knights Grand Cross with Collar of the Order of Merit of the Italian Republic,Lithuanian-American culture in Chicago,Lithuanian Roman Catholics,Lithuanian emigrants to the United States,Lithuanian male sprinters,Living people,Ludwig Maximilian University of Munich alumni,People of the United States Environmental Protection Agency,People who renounced United States citizenship,Politicians from Chicago,Politicians from Kaunas,Presidents of Lithuania,Recipients of St. George's Order of Victory,Recipients of the Collar of the Order of the Cross of Terra Mariana,Recipients of the Grand Star of the Decoration for Services to the Republic of Austria,Recipients of the Order of Prince Yaroslav the Wise, 1st class, 2nd class,Recipients of the Order of the White Eagle (Poland),Recipients of the President's Award for Distinguished Federal Civilian Service,UNESCO Goodwill Ambassadors,United States Army non-commissioned officers,Николай Коперник Их Сургуулийн хүндэт доктор,Баруун-Хойд их сургуулийн хүндэт доктор,Ереван Улсын Их Сургуулийн хүндэт доктор,Казахстаны их сургуулийн хүндэт доктор,Литвачууд,Ромын Клубийн гишүүн,Хүрээлэн буй орчин- ба байгаль орчны хамгаалалтын хүн,20-р зууны улс төрч,21-р зууны улс төрч,Хризантем одон шагналтан (их загалмай),Гурван Одод одон шагналтан (их загалмай одонгийн гинжтэй),Аврагч одон шагналтан (их загалмай),Финландын Цагаан Сарнай одон шагналтан (их загалмай одонгийн гинжтэй),Леопольдын одон шагналтан (их загалмай),Польшийн Дахин төрөлт одон шагналтан (их загалмай),Стара планина одон шагналтан,Инфант Дом Энрике гинжит одон шагналтан,Нидерландын Арслан одон шагналтан (их загалмай),Гэгээн Олафын одон шагналтан (их загалмай),Румыны Од шагналтан (колланэ),Унгар Улсын Гавьяаны одон шагналтан (их загалмай одонгийн гинжтэй),Украины Эрх чөлөөний одон шагналтан,Америкчууд,Kategorie:Ehrenbürger von Kaunas,Kategorie:Ehrendoktor der Aleksandras-Stulginskis-Universität,Kategorie:Ehrendoktor der Katholischen Universität von Amerika,Kategorie:Ehrendoktor der Mykolas-Romer-Universität,Kategorie:Ehrendoktor der Nikolaus-Kopernikus-Universität Toruń,Kategorie:Ehrendoktor der Northwestern University,Kategorie:Ehrendoktor der Sportuniversität Litauens,Kategorie:Ehrendoktor der Staatlichen Universität Baku,Kategorie:Ehrendoktor der Staatlichen Universität Jerewan,Kategorie:Ehrendoktor der Technischen Universität Kaunas,Kategorie:Ehrendoktor der Universität Klaipėda,Kategorie:Ehrendoktor der Universität Vilnius,Kategorie:Ehrendoktor der Vytautas-Magnus-Universität Kaunas,Kategorie:Ehrendoktor einer Universität in Kasachstan,Kategorie:Geboren 1926,Kategorie:Honorary Knight Grand Cross des Order of the Bath,Kategorie:Litauer,Kategorie:Litauischer Emigrant in den Vereinigten Staaten,Kategorie:Mann,Kategorie:Mitglied der Ehrenlegion (Großkreuz),Kategorie:Mitglied des Club of Rome,Kategorie:Person (Umwelt- und Naturschutz),Kategorie:Politiker (20. Jahrhundert),Kategorie:Politiker (21. Jahrhundert),Kategorie:Präsident (Litauen),Kategorie:Träger des Bundesverdienstkreuzes (Sonderstufe des Großkreuzes),Kategorie:Träger des Chrysanthemenordens (Großkreuz),Kategorie:Träger des Drei-Sterne-Ordens (Großkreuz mit Ordenskette),Kategorie:Träger des Erlöser-Ordens (Großkreuz),Kategorie:Träger des Falkenordens (Großkreuz),Kategorie:Träger des Finnischen Ordens der Weißen Rose (Großkreuz mit Ordenskette),Kategorie:Träger des Groß-Sterns des Ehrenzeichens für Verdienste um die Republik Österreich,Kategorie:Träger des Leopoldsordens (Großkreuz),Kategorie:Träger des Orden de Isabel la Católica,Kategorie:Träger des Ordens Polonia Restituta (Großkreuz),Kategorie:Träger des Ordens Stara Planina,Kategorie:Träger des Ordens des Fürsten Jaroslaw des Weisen (I. Klasse),Kategorie:Träger des Ordens des Infanten Dom Henrique (Collane),Kategorie:Träger des Ordens des Marienland-Kreuzes (Collane),Kategorie:Träger des Ordens des weißen Sterns (Collane),Kategorie:Träger des Ordens vom Niederländischen Löwen (Großkreuz),Kategorie:Träger des Sankt-Olav-Ordens (Großkreuz),Kategorie:Träger des Sterns von Rumänien (Collane),Kategorie:Träger des Verdienstordens der Italienischen Republik (Großkreuz mit Ordenskette),Kategorie:Träger des Verdienstordens der Republik Ungarn (Großkreuz mit Ordenskette),Kategorie:Träger des Vytautas-Magnus-Ordens (Großkreuz mit Ordenskette),Kategorie:Träger des Weißen Adlerordens,Kategorie:Träger des ukrainischen Ordens der Freiheit,Kategorie:UN-Goodwill-Botschafter,Kategorie:US-Amerikaner
Валентин Райчев,Валентин Райчев,1958 онд төрсөн,Болгарын олимпын аварга,Bulgarian male sport wrestlers,Living people,Medalists at the 1980 Summer Olympics,Olympic gold medalists for Bulgaria,Olympic medalists in wrestling,Olympic wrestlers of Bulgaria,Wrestlers at the 1980 Summer Olympics,Болгарчууд,Бөхийн олимпын аварга,Болгарын олимпын оролцогч,Болгарын бөх,1980 оны зуны олимпод оролцогч,Kategorie:Bulgare,Kategorie:Geboren 1958,Kategorie:Mann,Kategorie:Olympiasieger (Ringen),Kategorie:Olympiateilnehmer (Bulgarien),Kategorie:Ringer (Bulgarien),Kategorie:Teilnehmer der Olympischen Sommerspiele 1980
Валентин Серов,Валентин Серов,1865 онд төрсөн,1911 онд өнгөрсөн,19th-century male artists from the Russian Empire,19th-century painters from the Russian Empire,20th-century Russian male artists,20th-century Russian painters,Academic staff of the Moscow School of Painting, Sculpture and Architecture,Burials at Novodevichy Cemetery,Full Members of the Imperial Academy of Arts,Imperial Academy of Arts alumni,Jewish painters,Members of the Imperial Academy of Arts,Painters from Saint Petersburg,Peredvizhniki,Russian Impressionist painters,Russian male painters,Russian people of German-Jewish descent,Russian portrait painters,Хөрөг зураач,Оросууд,Kategorie:Geboren 1865,Kategorie:Gestorben 1911,Kategorie:Maler (Russisches Kaiserreich),Kategorie:Mann,Kategorie:Person als Namensgeber für einen Asteroiden,Kategorie:Porträtmaler,Kategorie:Russe
Валерий Лобановский,Валерий Лобановский,1939 онд төрсөн,2002 онд өнгөрсөн,Хөлбөмбөгийн довтлогч,ЗХУ-ын Коммунист намын гишүүн,Динамо Киев багийн тоглогч,Шахтёр Донецк багийн тоглогч,Украин улсын баатар,ЗХУ-ын шигшээ багийн хөлбөмбөгчин,ЗХУ-ын хөлбөмбөгийн дасгалжуулагч,ЗХУ-ын хөлбөмбөгчин,Украины хөлбөмбөгийн шигшээ багийн дасгалжуулагч,Украины хөлбөмбөгийн дасгалжуулагч,1986 FIFA World Cup managers,1990 FIFA World Cup managers,1992 AFC Asian Cup managers,Association football forwards,Burials at Baikove Cemetery,Communist Party of the Soviet Union members,Expatriate football managers in Kuwait,Expatriate football managers in the United Arab Emirates,FC Chornomorets Odesa players,FC Dnipro managers,FC Dynamo Kyiv managers,FC Dynamo Kyiv players,FC Shakhtar Donetsk players,Footballers from Kyiv,Kuwait national football team managers,Kyiv Polytechnic Institute alumni,Merited Coaches of Ukraine,Merited Coaches of the Soviet Union,Odesa National Polytechnic University alumni,Recipients of the title of Hero of Ukraine,Soviet First League managers,Soviet Top League managers,Soviet Top League players,Soviet Union international footballers,Soviet Union national football team managers,Soviet expatriate football managers,Soviet expatriate sportspeople in the United Arab Emirates,Soviet football managers,Soviet footballers,Soviet people of Polish descent,UEFA Euro 1988 managers,Ukraine national football team managers,Ukrainian Premier League managers,Ukrainian expatriate football managers,Ukrainian expatriate sportspeople in Kuwait,Ukrainian expatriate sportspeople in the United Arab Emirates,Ukrainian football managers,Ukrainian people of Polish descent,United Arab Emirates national football team managers,Хөлбөмбөгийн Европын Цомын Аварга,Зөвлөлтийн иргэн,ЗХУ-ын хөлбөмбөгийн улсын аварга,Днипрогийн тамирчин,Киевийн тамирчин,Украинчууд,Kategorie:Fußballnationalspieler (Sowjetunion),Kategorie:Fußballnationaltrainer (Kuwait),Kategorie:Fußballnationaltrainer (Sowjetunion),Kategorie:Fußballnationaltrainer (Ukraine),Kategorie:Fußballnationaltrainer (Vereinigte Arabische Emirate),Kategorie:Fußballspieler (Dynamo Kiew),Kategorie:Fußballspieler (Schachtar Donezk),Kategorie:Fußballspieler (Tschornomorez Odessa),Kategorie:Fußballtrainer (Dynamo Kiew),Kategorie:Fußballtrainer (FK Dnipro),Kategorie:Geboren 1939,Kategorie:Gestorben 2002,Kategorie:Held der Ukraine,Kategorie:Mann,Kategorie:Sieger des Fußball-Europapokals der Pokalsieger,Kategorie:Sowjetbürger,Kategorie:Sowjetischer Meister (Fußball),Kategorie:Sportler (Dnipro),Kategorie:Sportler (Kiew),Kategorie:Ukrainer
Василий Суриков,Василий Суриков,1848 онд төрсөн,1916 онд өнгөрсөн,19th-century male artists from the Russian Empire,19th-century painters from the Russian Empire,19th-century painters of historical subjects,20th-century Russian male artists,20th-century Russian painters,Burials at Vagankovo Cemetery,Full Members of the Imperial Academy of Arts,Imperial Academy of Arts alumni,Members of the Imperial Academy of Arts,People from Krasnoyarsk,People from Yeniseysk Governorate,Peredvizhniki,Russian male painters,Russian watercolorists,Казак,Оросууд,Kategorie:Geboren 1848,Kategorie:Gestorben 1916,Kategorie:Kosak,Kategorie:Maler (Russisches Kaiserreich),Kategorie:Mann,Kategorie:Person als Namensgeber für einen Asteroiden,Kategorie:Russe
