Мирослав Гермашевски,Мирослав Гермашевски,1941 онд төрсөн,2022 онд өнгөрсөн,Польшийн Дахин төрөлт одон шагналтан (командлагч),Бүгд Найрамдах Польш Улсын Гавьяаны алтан загалмай шагналтан,Сансрыг эзэмших гавьяаны төлөө медаль шагналтан,Лениний одон шагналтан,20th-century Polish military personnel,Commanders of the Order of Polonia Restituta,Foreign Heroes of the Soviet Union,Polish Air Force generals,Polish People's Army generals,Polish astronauts,Polish aviators,Recipients of the Gold Cross of Merit (Poland),Recipients of the Medal "For Merit in Space Exploration",Recipients of the Order of Lenin,Recipients of the Order of the Cross of Grunwald, 1st class,Recipients of the Scharnhorst Order,Salyut program cosmonauts,Вроцлавын хүндэт иргэн,ЗХУ-ын баатар,Инээмсэглэлийн одонгийн кавалер,Польшууд,Салют хөлгийн бүрэлдэхүүн,Союз хөлгийн бүрэлдэхүүн,Kategorie:Ehrenbürger von Breslau,Kategorie:Geboren 1941,Kategorie:Gestorben 2022,Kategorie:Held der Sowjetunion,Kategorie:Kavalier des Ordens des Lächelns,Kategorie:Mann,Kategorie:Militärpilot (Polen),Kategorie:Pole,Kategorie:Raumfahrer (Polen),Kategorie:Saljut-Besatzung,Kategorie:Sojus-Besatzung,Kategorie:Träger des Goldenen Verdienstkreuzes der Republik Polen,Kategorie:Träger des Leninordens,Kategorie:Träger des Ordens Polonia Restituta (Komtur)
Михаил Певцов,Михаил Певцов,1843 онд төрсөн,Оросын аялагч,1902 онд өнгөрсөн,Russian explorers,Ази судлаач,Оросууд,Гэгээн Аннагийн одон шагналтан,Гэгээн Владимирын одон шагналтан,Оросын Гэгээн Станислав одон шагналтан,Kategorie:Asienforscher,Kategorie:Geboren 1843,Kategorie:Gestorben 1902,Kategorie:Mann,Kategorie:Russe,Kategorie:Träger des Ordens der Heiligen Anna,Kategorie:Träger des Ordens des Heiligen Wladimir,Kategorie:Träger des Sankt-Stanislausordens (Russland)
Михаил Пыльцов,Михаил Пыльцов,1846 онд төрсөн,1898 онд өнгөрсөн,Оросын аялагч,Russian explorers
Михалы Фодор,Михалы Фодор,1950 онд төрсөн,Hungarian male sport wrestlers,Living people,Olympic wrestlers of Hungary,Sportspeople from Hajdú-Bihar County,Wrestlers at the 1976 Summer Olympics
Мохамед бин Салман,Мохамед бин Салман,1985 онд төрсөн,21st-century Saudi Arabian politicians,Children of Salman of Saudi Arabia,Crown Princes of Saudi Arabia,Defense ministers of Saudi Arabia,Deputy Prime Minister of Saudi Arabia,Foreign recipients of the Nishan-e-Pakistan,Government ministers of Saudi Arabia,King Saud University alumni,Living people,Muslim monarchs,People appearing on C-SPAN,People from Riyadh,Prime Ministers of Saudi Arabia,Saudi Arabian Sunni Muslims,Saudi Arabian billionaires,Saudi Arabian nationalists,Saudi Arabian princes,Use British English from December 2021,Хүн амины хэрэгтэн,21-р зууны улс төрч,Саудын Арабчууд,Kategorie:Geboren 1985,Kategorie:Mann,Kategorie:Person (Mordfall),Kategorie:Politiker (21. Jahrhundert),Kategorie:Prinz (Saudi-Arabien),Kategorie:Saudi-Araber,Kategorie:Verteidigungsminister (Saudi-Arabien)
Мстислав Келдыш,Мстислав Келдыш,1911 онд төрсөн,1978 онд өнгөрсөн,Москвагийн физик ба технологийн хүрээлэнгийн багш,Хүндэт легионы гишүүн (командлагч),АНУ-ын Урлаг ба Шинжлэх Ухааны Академийн гишүүн,Эдинбургийн Ханы Нийгэмлэгийн гишүүн,Зөвлөлтийн социалист хөдөлмөрийн баатар,Лениний нэрэмжит шагналтан,Леопольдинагийн гишүүн,Зүүн Германы Шинжлэх Ухааны Академийн гишүүн,Москвагийн Улсын Их Сургуулийн төгсөгч,Ломоносовын нэрэмжит Их Алтан Медаль шагналтан,Георгий Димитровын одон шагналтан,Лениний одон шагналтан,Хөдөлмөрийн Гавьяаны Улаан Тугийн одон шагналтан (ЗХУ),Зөвлөлтийн зохион бүтээгч,ЗХУ-ын сансрын тээврийн анхдагч,Сталиний нэрэмжит шагналтан,Academic staff of the Moscow Institute of Physics and Technology,Biography with signature,Burials at the Kremlin Wall Necropolis,Central Aerohydrodynamic Institute employees,Commanders of the Legion of Honour,Corresponding members of the Romanian Academy,Early spaceflight scientists,Eighth convocation members of the Supreme Soviet of the Soviet Union,Fellows of the American Academy of Arts and Sciences,Fellows of the Royal Society of Edinburgh,Foreign Members of the Bulgarian Academy of Sciences,Full Members of the USSR Academy of Sciences,Heroes of Socialist Labour,Lenin Prize winners,Male non-fiction writers,Members of the Central Committee of the 22nd Congress of the Communist Party of the Soviet Union,Members of the Central Committee of the 23rd Congress of the Communist Party of the Soviet Union,Members of the Central Committee of the 24th Congress of the Communist Party of the Soviet Union,Members of the Central Committee of the 25th Congress of the Communist Party of the Soviet Union,Members of the German Academy of Sciences Leopoldina,Members of the German Academy of Sciences at Berlin,Moscow State University alumni,Ninth convocation members of the Supreme Soviet of the Soviet Union,Presidents of the Russian Academy of Sciences,Presidents of the USSR Academy of Sciences,Recipients of the Lomonosov Gold Medal,Recipients of the Order of Georgi Dimitrov,Recipients of the Order of Lenin,Recipients of the Order of the Red Banner of Labour,Scientists from Riga,Seventh convocation members of the Supreme Soviet of the Soviet Union,Sixth convocation members of the Supreme Soviet of the Soviet Union,Soviet inventors,Soviet male writers,Soviet mathematicians,Soviet non-fiction writers,Soviet space program personnel,Soviet spaceflight pioneers,Stalin Prize winners,20-р зууны Леопольдинагийн гишүүн,Оросын Шинжлэх Ухааны Академийн гишүүн,Саксоны Шинжлэх Ухааны Академийн гишүүн,ЗХУ-ын Коммунист намын төв хорооны гишүүн,Ригагийн хүн,Оросууд,Зөвлөлтийн иргэн,Бернардо О’Хиггинсийн одон шагналтан,Kategorie:Absolvent der Lomonossow-Universität Moskau,Kategorie:Geboren 1911,Kategorie:Gestorben 1978,Kategorie:Held der sozialistischen Arbeit,Kategorie:Hochschullehrer (MIPT),Kategorie:Mann,Kategorie:Mathematischer Analytiker (20. Jahrhundert),Kategorie:Mitglied der Akademie der Wissenschaften der DDR,Kategorie:Mitglied der American Academy of Arts and Sciences,Kategorie:Mitglied der Ehrenlegion (Kommandeur),Kategorie:Mitglied der Leopoldina (20. Jahrhundert),Kategorie:Mitglied der Royal Society of Edinburgh,Kategorie:Mitglied der Russischen Akademie der Wissenschaften,Kategorie:Mitglied der Sächsischen Akademie der Wissenschaften,Kategorie:Mitglied des Zentralkomitees der KPdSU,Kategorie:Person (Riga),Kategorie:Person als Namensgeber für einen Asteroiden,Kategorie:Person als Namensgeber für einen Mondkrater,Kategorie:Raumfahrtpionier (Sowjetunion),Kategorie:Russe,Kategorie:Sowjetbürger,Kategorie:Träger der Lomonossow-Goldmedaille,Kategorie:Träger der finnischen Auszeichnung Akademiker,Kategorie:Träger des Leninordens,Kategorie:Träger des Leninpreises,Kategorie:Träger des Ordens Bernardo O’Higgins,Kategorie:Träger des Ordens des Roten Banners der Arbeit,Kategorie:Träger des Stalinpreises
Муслим Магомаев,Муслим Магомаев,1885 онд төрсөн,1937 онд өнгөрсөн,ЗХУ-ын хөгжмийн зохиолч,ЗХУ-ын удирдаач,20th-century Azerbaijani musicians,20th-century conductors (music),20th-century deaths from tuberculosis,20th-century male musicians,Azerbaijani composers,Azerbaijani conductors (music),Azerbaijani opera composers,Honored Art Workers of the Azerbaijan SSR,Male classical composers,People from Groznensky District,People from Terek Oblast,Soviet composers,Soviet conductors (music),Soviet male composers,Soviet opera composers,Transcaucasian Teachers Seminary alumni,Tuberculosis deaths in Russia,Tuberculosis deaths in the Soviet Union,Азербайжанчууд,Kategorie:Aserbaidschaner,Kategorie:Geboren 1885,Kategorie:Gestorben 1937,Kategorie:Komponist (Aserbaidschan),Kategorie:Mann,Kategorie:Verdienter Künstler der Aserbaidschanischen Sozialistischen Sowjetrepublik
Нацумэ Сосэки,Нацумэ Сосэки,1867 онд төрсөн,1916 онд өнгөрсөн,19th-century Japanese novelists,19th-century Japanese poets,19th-century Japanese short story writers,19th-century pseudonymous writers,20th-century Japanese novelists,20th-century Japanese short story writers,20th-century pseudonymous writers,Alumni of University College London,Deaths from ulcers,Japanese expatriates in the United Kingdom,Japanese haiku poets,Japanese male short story writers,Natsume Sōseki,People from Shinjuku,People of Meiji-period Japan,The Asahi Shimbun people,University of Tokyo alumni,Writers from Tokyo,Зохиогч,Токиогийн Багшийн Их Сургуулийн багш,Токио Их Сургуулийн багш,Япончууд,19-р зууны утга зохиол,20-р зууны утга зохиол,Япон хэлээрх утга зохиол,Псевдоним,Роман,Kategorie:Autor,Kategorie:Geboren 1867,Kategorie:Gestorben 1916,Kategorie:Hochschullehrer (Pädagogische Universität Tokio),Kategorie:Hochschullehrer (Universität Tokio),Kategorie:Japaner,Kategorie:Literatur (19. Jahrhundert),Kategorie:Literatur (20. Jahrhundert),Kategorie:Literatur (Japanisch),Kategorie:Mann,Kategorie:Person als Namensgeber für einen Asteroiden,Kategorie:Pseudonym,Kategorie:Roman, Epik
Никола Амати,Никола Амати,1596 онд төрсөн,1684 онд өнгөрсөн,Luthiers from Cremona,Kategorie:Geboren 1596,Kategorie:Geigenbauer,Kategorie:Gestorben 1684,Kategorie:Historische Person (Italien),Kategorie:Mann,Kategorie:Person (Cremona)
Николай Михайлович Карамзин,Николай Михайлович Карамзин,1826 онд өнгөрсөн,Ульяновскийн хүн,Оросын орчуулагч,1766 онд төрсөн,18th-century male writers,18th-century poets from the Russian Empire,19th-century historians from the Russian Empire,19th-century novelists from the Russian Empire,19th-century poets from the Russian Empire,Burials at Tikhvin Cemetery,Conservatism in Russia,French–Russian translators,Honorary members of the Saint Petersburg Academy of Sciences,Members of the Russian Academy,People from Ulyanovsk,Recipients of the Order of St. Anna, 1st class,Recipients of the Order of St. Vladimir, 3rd class,Russian male poets,Russian male writers,Russian people of Tatar descent,Russian translators,Russian untitled nobility,Зохиогч,Оросын Шинжлэх Ухааны Академийн хүндэт гишүүн,Түүхч,18-р зууны утга зохиол,19-р зууны утга зохиол,Орос хэлээрх утга зохиол,Оросууд,Kategorie:Autor,Kategorie:Ehrenmitglied der Russischen Akademie der Wissenschaften,Kategorie:Geboren 1766,Kategorie:Gestorben 1826,Kategorie:Historiker,Kategorie:Literatur (18. Jahrhundert),Kategorie:Literatur (19. Jahrhundert),Kategorie:Literatur (Russisch),Kategorie:Mann,Kategorie:Russe
Николай Цискаридзе,Николай Цискаридзе,1973 онд төрсөн,Францын Урлаг ба Утга Зохиолын одон шагналтан (рыцарь),Ballet dancers from Georgia (country),Biography with signature,Bolshoi Ballet principal dancers,Chevaliers of the Ordre des Arts et des Lettres,Living people,Male ballet dancers from Georgia (country),Male dancers from Tbilisi,People's Artists of Russia,Prix Benois de la Danse winners,Russian people of Georgian descent
Николло Паганини,Николло Паганини,1782 онд төрсөн,1840 онд өнгөрсөн,19th-century Italian male musicians,19th-century classical composers,19th-century classical violinists,Chamber virtuosi of the Emperor of Austria,Composers for the classical guitar,Composers for violin,Composers with IMSLP links,Deal with the Devil,Italian Romantic composers,Italian classical composers,Italian classical violinists,Italian male classical composers,Male classical violinists,Musicians from Genoa,Musicians from Parma,Niccolò Paganini,String quartet composers,Италийн хөгжмийн зохиолч,Романтизм хөгжмийн зохиолч,Женовагийн хүн,Алтан Шпорн одон шагналтан,Kategorie:Geboren 1782,Kategorie:Gestorben 1840,Kategorie:Historische Person (Italien),Kategorie:Klassischer Geiger,Kategorie:Komponist (Italien),Kategorie:Komponist (Romantik),Kategorie:Mann,Kategorie:Niccolò Paganini,Kategorie:Person (Genua),Kategorie:Person als Namensgeber für einen Asteroiden,Kategorie:Träger des Ordens vom Goldenen Sporn
Нородом Сианук,Нородом Сианук,1922 онд төрсөн,2012 онд өнгөрсөн,Хүндэт легионы гишүүн (их загалмай),Польшийн Дахин төрөлт одон шагналтан (их загалмай),Цагаан Арслан одон шагналтан (их загалмай),Хүндэт легионы гишүүн (их офицер),Италийн Бүгд Найрамдах Улсын Гавьяаны одон шагналтан (их загалмай),Вьетнамын дайны хүн,Камбожийн ерөнхий сайд,Суворовын 1-р зэргийн одон шагналтан,20th-century Cambodian male actors,20th-century Cambodian monarchs,20th-century Cambodian politicians,20th century in Cambodia,21st-century Cambodian monarchs,Anti-imperialism,Asian democratic socialists,Cambodian Buddhist monarchs,Cambodian Buddhists,Cambodian Theravada Buddhists,Cambodian collaborators with Imperial Japan,Cambodian exiles,Cambodian expatriates in France,Cambodian film directors,Cambodian independence activists,Cambodian nationalists,Cambodian socialists,Exiled royalty,FUNCINPEC politicians,Grand Cross of the Legion of Honour,Grand Crosses of the National Order of Mali,Grand Crosses of the Order of Polonia Restituta,Grand Crosses of the Order of the White Lion,Grand Officers of the Legion of Honour,Heads of state of Cambodia,House of Norodom,Knights Grand Cross of the Order of Merit of the Italian Republic,Leaders ousted by a coup,Monarchs who abdicated,Norodom Sihanouk,People of the Cold War,People of the Vietnam War,People sentenced to death in absentia,Political party founders,Portal templates with redlinked portals,Prime Ministers of Cambodia,Recipients of the Darjah Utama Temasek,Recipients of the Grand Decoration with Sash for Services to the Republic of Austria,Recipients of the National Order of Vietnam,Recipients of the Order of Suvorov, 1st class,Recipients of the Order of the Dragon of Annam,Sangkum politicians,World War II political leaders,Белградын хүндэт иргэн,Камбожчууд,Камбожийн хан,Хризантем одон шагналтан (их загалмай одонгийн гинжний хамт),Австрийн Бүгд Найрамдах Улсын төлөөх гавьяаны туузат их алтан хүндэт тэмдгийн шагналтан,Нил одон шагналтан,Цагаан Арслан одон шагналтан,Kategorie:Ehrenbürger von Belgrad,Kategorie:FUNCINPEC-Mitglied,Kategorie:Geboren 1922,Kategorie:Gestorben 2012,Kategorie:Kambodschaner,Kategorie:König (Kambodscha),Kategorie:Mann,Kategorie:Mitglied der Ehrenlegion (Großoffizier),Kategorie:Parteivorsitzender (Kambodscha),Kategorie:Premierminister (Kambodscha),Kategorie:Staatsoberhaupt (Kambodscha),Kategorie:Träger des Chrysanthemenordens (Großkreuz mit Ordenskette),Kategorie:Träger des Großen Goldenen Ehrenzeichens am Bande für Verdienste um die Republik Österreich,Kategorie:Träger des Nil-Ordens,Kategorie:Träger des Ordens Polonia Restituta (Großkreuz),Kategorie:Träger des Ordens des Weißen Löwen,Kategorie:Träger des Suworow-Ordens I. Klasse,Kategorie:Träger des Verdienstordens Nigers (Großkreuz),Kategorie:Träger des Verdienstordens der Italienischen Republik (Großkreuz)
Олег Блохин,Олег Блохин,1952 онд төрсөн,1986 оны хөлбөмбөгийн ДАШТ-д оролцогч,Хөлбөмбөгийн довтлогч,Европын оны шилдэг хөлбөмбөгчин,Динамо Киев багийн тоглогч,ЗХУ-ын гавьяат тамирчин,ЗХУ-ын олимпын хүрэл медальтан,Цэцэн Ярослав вангийн одон шагналтан (2-р зэрэг),ЗХУ-ын шигшээ багийн хөлбөмбөгчин,ЗХУ-ын хөлбөмбөгчин,Украины хөлбөмбөгийн шигшээ багийн дасгалжуулагч,Украины хөлбөмбөгийн дасгалжуулагч,Украины хөлбөмбөгчин,1982 FIFA World Cup players,1986 FIFA World Cup players,2006 FIFA World Cup managers,AEK Athens F.C. managers,Aris Limassol FC players,Association football forwards,Ballon d'Or winners,Communist Party of Ukraine politicians,Cypriot First Division players,Dynamo sports society athletes,Expatriate football managers in Greece,Expatriate football managers in Russia,Expatriate footballers in Austria,Expatriate footballers in Cyprus,FC Dynamo Kyiv managers,FC Dynamo Kyiv players,FC Moscow managers,FIFA Men's Century Club,Footballers at the 1972 Summer Olympics,Footballers at the 1976 Summer Olympics,Footballers from Kyiv,Fourth convocation members of the Verkhovna Rada,Honoured Masters of Sport of the USSR,Hromada (political party) politicians,Ionikos F.C. managers,Living people,Medalists at the 1972 Summer Olympics,Medalists at the 1976 Summer Olympics,Merited Coaches of Ukraine,Olympiacos F.C. managers,Olympic bronze medalists for the Soviet Union,Olympic footballers of the Soviet Union,Olympic medalists in football,PAOK FC managers,Recipients of the Order of Prince Yaroslav the Wise, 2nd class,Russian Premier League managers,SK Vorwärts Steyr players,Social Democratic Party of Ukraine (united) politicians,Soviet Top League players,Soviet Union international footballers,Soviet expatriate footballers,Soviet expatriate sportspeople in Austria,Soviet expatriate sportspeople in Cyprus,Soviet footballers,Super League Greece managers,Third convocation members of the Verkhovna Rada,UEFA Euro 2012 managers,UEFA Golden Players,Ukraine national football team managers,Ukrainian Premier League managers,Ukrainian expatriate football managers,Ukrainian expatriate footballers,Ukrainian expatriate sportspeople in Austria,Ukrainian expatriate sportspeople in Cyprus,Ukrainian expatriate sportspeople in Greece,Ukrainian expatriate sportspeople in Russia,Ukrainian football managers,Ukrainian footballers,Ukrainian people of Russian descent,Ukrainian sportsperson-politicians,Киевийн хүндэт иргэн,ЗХУ-ын олимпын оролцогч,Хөлбөмбөгийн Европын Цомын Аварга,Зөвлөлтийн иргэн,ЗХУ-ын оны шилдэг хөлбөмбөгчин,ЗХУ-ын хөлбөмбөгийн улсын аварга,1972 оны зуны олимпод оролцогч,1976 оны зуны олимпод оролцогч,Цэцэн Ярослав вангийн одон шагналтан (4-р зэрэг),Украинчууд,Kategorie:Ballon-d’Or-Gewinner,Kategorie:Ehrenbürger von Kiew,Kategorie:Fußballnationalspieler (Sowjetunion),Kategorie:Fußballnationaltrainer (Ukraine),Kategorie:Fußballspieler (Aris Limassol),Kategorie:Fußballspieler (Dynamo Kiew),Kategorie:Fußballspieler (SK Vorwärts Steyr),Kategorie:Fußballtrainer (AEK Athen),Kategorie:Fußballtrainer (Dynamo Kiew),Kategorie:Fußballtrainer (FK Moskau),Kategorie:Fußballtrainer (Ionikos Nikea),Kategorie:Fußballtrainer (Olympiakos Piräus),Kategorie:Fußballtrainer (PAOK Thessaloniki),Kategorie:Geboren 1952,Kategorie:Mann,Kategorie:Olympiateilnehmer (Sowjetunion),Kategorie:Sieger des Fußball-Europapokals der Pokalsieger,Kategorie:Sowjetbürger,Kategorie:Sowjetischer Fußballer des Jahres,Kategorie:Sowjetischer Meister (Fußball),Kategorie:Teilnehmer an einer Fußball-Weltmeisterschaft (Sowjetunion),Kategorie:Teilnehmer der Olympischen Sommerspiele 1972,Kategorie:Teilnehmer der Olympischen Sommerspiele 1976,Kategorie:Träger des Ordens des Fürsten Jaroslaw des Weisen (IV. Klasse),Kategorie:Ukrainer
Олег Табаков,Олег Табаков,1935 онд төрсөн,2018 онд өнгөрсөн,ЗХУ-ын Коммунист намын гишүүн,Ардын Жүжигчин (ЗСБНХОУ),Ардын Жүжигчин (ЗХУ),ЗХУ-ын Ард түмний найрамдлын одон шагналтан,Хөдөлмөрийн Гавьяаны Улаан Тугийн одон шагналтан (ЗХУ),Төрийн шагналтан (ЗХУ),Оросын театрын найруулагч,20th-century Russian male actors,21st-century Russian male actors,Academic staff of High Courses for Scriptwriters and Film Directors,Academic staff of Moscow Art Theatre School,Academicians of the National Academy of Motion Picture Arts and Sciences of Russia,Actors from Saratov,Burials at Novodevichy Cemetery,Communist Party of the Soviet Union members,Deaths from sepsis,Full Cavaliers of the Order "For Merit to the Fatherland",Honorary Members of the Russian Academy of Arts,Honored Artists of the RSFSR,Incomplete lists from April 2009,Moscow Art Theatre School alumni,People's Artists of the RSFSR,People's Artists of the USSR,Recipients of the Legion of Honour,Recipients of the Order of Friendship of Peoples,Recipients of the Order of the Cross of Terra Mariana, 3rd Class,Recipients of the Order of the Red Banner of Labour,Recipients of the USSR State Prize,Russian male film actors,Russian male stage actors,Russian male television actors,Russian male voice actors,Russian theatre directors,Soviet male film actors,Soviet male stage actors,Soviet male television actors,Soviet male voice actors,Soviet theatre directors,Кино жүжигчин,Хүндэт легионы гишүүн (офицер),Оросууд,Зөвлөлтийн иргэн,Театрын дарга,Театрын жүжигчин,Оросын аугаа эх орны гавьяаны одон шагналтан,Kategorie:Filmschauspieler,Kategorie:Geboren 1935,Kategorie:Gestorben 2018,Kategorie:Mann,Kategorie:Mitglied der Ehrenlegion (Offizier),Kategorie:Russe,Kategorie:Sowjetbürger,Kategorie:Theaterleiter,Kategorie:Theaterschauspieler,Kategorie:Träger des Ordens des Marienland-Kreuzes (III. Klasse),Kategorie:Träger des Verdienstordens für das Vaterland,Kategorie:Volkskünstler der UdSSR (Darstellende Kunst)
Петр Павел,Петр Павел,1961 онд төрсөн,Гавьяаны Легион одон шагналтан (командлагч),Хүндэт легионы гишүүн (офицер),Чехийн ерөнхийлөгч,20th-century Czech people,21st-century Czech politicians,Alumni of King's College London,Candidates in the 2023 Czech presidential election,Chiefs of the General Staff (Czech Republic),Commanders of the Legion of Merit,Communist Party of Czechoslovakia politicians,Czech atheists,Czech generals,Foreign recipients of the Legion of Merit,Graduates of the Royal College of Defence Studies,Living people,NATO officials,Officers of the Legion of Honour,People from Planá,Petr Pavel,Presidents of the Czech Republic,Recipients of Medal of Heroism (Czech Republic),Recipients of the Cross for Military Valour,Recipients of the Legion of Honour,United Nations Protection Force soldiers,Use British English from January 2023,Чехословакийн Коммунист Намын гишүүн,Бельгийн Титэм одон шагналтан (их загалмай),Чехүүд,Чехословакчууд,Kategorie:Armeegeneral (Tschechien),Kategorie:Chef des Generalstabes der Streitkräfte der Tschechischen Republik,Kategorie:Geboren 1961,Kategorie:KSČ-Mitglied,Kategorie:Kandidat für das Präsidentenamt (Tschechien),Kategorie:Mann,Kategorie:Militärperson (NATO),Kategorie:Mitglied der Ehrenlegion (Offizier),Kategorie:Präsident (Tschechien),Kategorie:Stellvertreter des Chefs des Generalstabes der Streitkräfte der Tschechischen Republik,Kategorie:Träger des Ordens Legion of Merit (Kommandeur),Kategorie:Träger des belgischen Kronenordens (Großkreuz),Kategorie:Tscheche,Kategorie:Tschechoslowake
